{
  "id": 0,
  "version": "69c142fd-9855-4610-9bf0-6c586053789",
  "layerType": "IntegratedMesh",
  "spatialReference": {
    "wkid": 4326,
    "vcsWkid": 3855
  },
  "description": "Model",
  "capabilities": [
    "View",
    "Query"
  ],
  "store": {
    "id": "0",
    "profile": "meshpyramids",
    "version": "1.7",
    "resourcePattern": [
      "3dNodeIndexDocument",
      "SharedResource",
      "Geometry",
      "Attributes"
    ],
    "rootNode": "./nodes/root",
    "extent": [
      -118.27169176054323,
      34.037943166984874,
      -118.26445095354559,
      34.044311231767118
    ],
    "indexCRS": "http://www.opengis.net/def/crs/EPSG/0/4326",
    "vertexCRS": "http://www.opengis.net/def/crs/EPSG/0/4326",
    "normalReferenceFrame": "earth-centered",
    "attributeEncoding": "application/octet-stream; version=1.6",
    "textureEncoding": [
      "image/jpeg"
    ],
    "lodType": "MeshPyramid",
    "lodModel": "node-switching",
    "defaultGeometrySchema": {
      "header": [
        {
          "property": "vertexCount",
          "type": "UInt32"
        },
        {
          "property": "featureCount",
          "type": "UInt32"
        }
      ],
      "topology": "PerAttributeArray",
      "ordering": [
        "position",
        "normal",
        "uv0",
        "color"
      ],
      "vertexAttributes": {
        "position": {
          "valueType": "Float32",
          "valuesPerElement": 3
        },
        "normal": {
          "valueType": "Float32",
          "valuesPerElement": 3
        },
        "uv0": {
          "valueType": "Float32",
          "valuesPerElement": 2
        },
        "color": {
          "valueType": "UInt8",
          "valuesPerElement": 4
        }
      },
      "featureAttributeOrder": [
        "id",
        "faceRange"
      ],
      "featureAttributes": {
        "id": {
          "valueType": "UInt64",
          "valuesPerElement": 1
        },
        "faceRange": {
          "valueType": "UInt32",
          "valuesPerElement": 2
        }
      }
    }
  },
  "heightModelInfo": {
    "heightModel": "gravity_related_height",
    "vertCRS": "EGM2008_Geoid",
    "heightUnit": "meter"
  },
  "nodePages": {
    "nodesPerPage": 64,
    "lodSelectionMetricType": "maxScreenThresholdSQ"
  },
  "materialDefinitions": [
    {
      "doubleSided": true,
      "pbrMetallicRoughness": {
        "baseColorTexture": {
          "textureSetDefinitionId": 0,
          "texCoord": 0
        }
      }
    }
  ],
  "textureSetDefinitions": [
    {
      "formats": [
        {
          "name": "0",
          "format": "jpg"
        },
        {
          "name": "0_0_1",
          "format": "dds"
        }
      ]
    }
  ],
  "geometryDefinitions": [
    {
      "geometryBuffers": [
        {
          "offset": 8,
          "position": {
            "type": "Float32",
            "component": 3
          },
          "normal": {
            "type": "Float32",
            "component": 3
          },
          "uv0": {
            "type": "Float32",
            "component": 2
          },
          "color": {
            "type": "UInt8",
            "component": 4
          },
          "featureId": {
            "type": "UInt64",
            "component": 1,
            "binding": "per-feature"
          },
          "faceRange": {
            "type": "UInt32",
            "component": 2,
            "binding": "per-feature"
          }
        }
      ]
    }
  ]
}